example_id	sentence	dataset	index	guideline
6143	"Ok Im actually very offended by this. I do to like them to suck on some toes when Im fucking a whore. If she has nice feet it's like , such a turn on for me. And women are such sluts they all go for it""Â¦"	dynahate	18847	attacking derogatory term
6145	its bewildering how much people with perverted outlooks try to dominate all of our tv and media. I'd ban gays from the bbc	dynahate	9610	attacking derogatory term
6146	I know some people like it, but I've always felt queasy about Parental roleplay. In the old days, since those qu33rs couldn't actually marry each other, one loophole would be to adopt one another. I've always found the idea creepy when these people keep up the appearances of being normal and non perverted in public	dynahate	18623	attacking derogatory term
6147	Those freaks are not all perverts trying to get into women's locker rooms. Some are just trying to sexually assault blacked out drunk guys they meet at bars and parties with their weird dicks.	dynahate	22019	attacking derogatory term
6149	So long as a fagggg sits in a position to adjudicate right and wrong among you morons a flag flies over this nation and it is lavender in color, blush pink, and it has the symbol of their twisted values on it, and it flies and flutters high above the stars and stripes, high above the Kansas state flag, and high above every other symbol. This nation is as stamped and fully identified as being perverted as the ancient city-states of Sodom and Gomorrah.	dynahate	25986	attacking derogatory term
6150	Virtually all the people who play this sick ventures with him are Jews, and most are gay too . Barack whole life has been a sordid cesspool and saga of intensely perverted homosexual buggery	dynahate	25999	attacking derogatory term
6151	The Jews didn't create Islam at all. The jews somewhat perverted Islam. For example ISIS.	dynahate	26529	attacking derogatory term
6152	Blood donation rules regarding gay and bisexual men have been often based more on prejudice than hard empirical science. Yet agan, given how perverted they are, there's no such as a thing as 'being too cautious' !.	dynahate	27895	attacking derogatory term
6154	I had a mixed friend/flatmate, we weren't too close, and it was long ago. He looked white, no darker than many Southern Europeans, and grew up in Europe and was completely integrated but apparently was half Arab or smth and it became more and more clear that he was some sexual pervert that was into S&M stuff (even with men), feet (possibly worse than the pope) and thus just another non-White weirdo.	dynahate	33539	attacking derogatory term
6155	"Vagina owners are disg*stin' perverts. No need to project to rest of us humans. But, why is it when women do something shite, internet simps always say ""humans"" or ""people"". WO MEN. Say their name, you simps!"	dynahate	34107	attacking derogatory term
6157	trans people are perverts	dynahate	35711	attacking derogatory term
6158	all gays are perverts	dynahate	35833	attacking derogatory term
6159	Gays are always pervert	dynahate	36752	attacking derogatory term
6160	Why does everyone in the LGBT community have to be a pervert!	dynahate	37177	attacking derogatory term
6161	Trans people need to grow up and realise they're perverts	dynahate	39474	attacking derogatory term
6162	if a lingerie or bikini model makes you nervous, just remember...she is literally a prostitute	dynahate	12615	attacking derogatory term
6163	But women are all prostitutes in one way or another	dynahate	14308	attacking derogatory term
6164	I think women cant be used for nothing other than sex, AND you have to pay for sex with them no matter what kind of relationship you're in. If she's your girlfriend, you just dont know how much you're going to pay, compared to a prostitute where you know exactly how much you're paying at what you are paying for.	dynahate	16904	attacking derogatory term
6165	these prostitutes were actually coalburners so don't feel sorry for them	dynahate	17116	attacking derogatory term
6169	Best thing men can do for whores is smack them in the face with the dildo they pay cheap prostitutes to pegg them with.	dynahate	22107	attacking derogatory term
6170	I personally think women cant be used for anything other than sex, AND you have to pay for sex with them no matter what kind of relationship you're in. If she's your girlfriend, you just dont know how much you're going to pay, compared to a prostitute where you know exactly how much you're paying at what you are paying for.	dynahate	22934	attacking derogatory term
6171	Of course you won't give up. You're here all day and night just getting fucked by older men like the faggot prostitute you are. You have no life.	dynahate	28007	attacking derogatory term
6172	You have to put some proper efforts before you get pussy... (1) Date... (2) Restaurants and/or movies (3) A Vacation may be... Lot of expenses I assume atleast $500+ also.. the time you get to enjoy pussy is max 1 hour... basically you are looking for beautiful prostitutes... The risks are... (1) #meToo (2) Rape charges (3) Unwanted pregnancy (4) Paternity trap (5) above all marriage trap (6) emotional issues (7) need to deal with their nagging (8) so much before and after work... Instead you can literally get a beautiful prostitute with STD tested negative and she will focus on your pleasure than her and there no before or after risks involved... Realistically all women are prostitutes itâÃÃ´s just some has different payment method (marriage, money, power, lust, excitement...)	dynahate	31753	attacking derogatory term
6173	I'm not trying to impede anyone, but once a slut, always a slut. I'm more of a long term relationship guy, I'm not gonna settle for a dozen Chads' used up cum dumpster, or an online gourmet prostitute. Your make your choices you get the results.	dynahate	31775	attacking derogatory term
6175	"British colonial rulers deemed the Indians as ""criminals"" in the 1800s and I still continue to see them as thieves and prostitutes."	dynahate	33563	attacking derogatory term
6177	Women say they want equality and then they go out and dress like prostitutes	dynahate	36695	attacking derogatory term
6300	jews are worthless	dynahate	1257	less than adequate
6303	What a worthless excuse of a human, that's women for you	dynahate	1853	less than adequate
6304	Can't tell the difference between your woman and a worthless piece of junk? Divorce her.	dynahate	1918	less than adequate
6307	this worthless piece of Chinese trash should not be called a human being!	dynahate	2249	less than adequate
6308	This worthless piece of trash should not be here. Foreigners never work!	dynahate	2886	less than adequate
6311	i want to smash that worthless woman into a million fucking pieces	dynahate	3160	less than adequate
6312	worthless black chimp- get back to the jungle where your kind belongs	dynahate	6982	less than adequate
6313	I think you should just end your life now while somebody still likes you, you worthless pole	dynahate	7229	less than adequate
6314	you fauxbian... You are as worthless as a plastic bag	dynahate	7327	less than adequate
6315	I'm a bitch but you are a worthless piece of Indian scum	dynahate	8712	less than adequate
6316	i don't really care. I have tried hard enough but now I do not feel the need to show any respect to women, they are all worthless.	dynahate	9111	less than adequate
6317	being black will not help you here, we know you're worthless	dynahate	9350	less than adequate
6318	All these worthless eastern Europeans think they have been hard done by, taking advantage of brexit for pity points. It's so frustrating to say the least. Honestly it makes me kind of mad to see.	dynahate	9850	less than adequate
6319	some communities like bengalis think they are victims all of the time. They are worthless garbage even insects, I personally won't go near any of them	dynahate	9860	less than adequate
6320	There is so much ignorance about the working class. I think many people don't want to understand how worthless they are.	dynahate	11760	less than adequate
6322	You are an philo-semitic, worthless piece of rubbish. Or maybe you are just a plain ol' Jew. Whatever the case, shut up	dynahate	12905	less than adequate
6325	I condemn anyone who deserves condemnation for whatever the reason. Don't be a worthless nsensitive twat demanding shit that changes nothing, like the arabs	dynahate	14500	less than adequate
6327	Childhood is admiring Hitler. Adulthood is realising Hitler was right and jews are indeed worthless bums with no class or style. Hitler just tried to achive greatness.	dynahate	16024	less than adequate
6331	oh god they let the weak and worthless faggots of society pretend like they're the best. It's cruel, really	dynahate	18873	less than adequate
6332	TRANS is defined as: An umbrella term to describe people whose gender is not the same as, or does not sit comfortably with, the sex they were assigned at birth. Trans people may describe themselves using one or more of a wide variety of terms, including (but not limited to) transgender, transsexual, gender-queer (GQ), gender-fluid, non-binary, gender-variant, crossdresser, genderless, agender, nongender, third gender, bi-gender, trans man, trans woman,trans masculine, trans feminine and neutrois. I say we just call them trannies to not waste time on the worthless weirdos.	dynahate	20767	less than adequate
6334	Poor man, beast Leigh thinking that she can just put her elbow on his shoulder and wave her extensions in his face. She is honestly just like all other women: worthless	dynahate	21616	less than adequate
6335	The government is not making things right for small business owners and keep giving benefits to the working class scum and worthless immigrants!	dynahate	22164	less than adequate
6336	Every single person theyâve shown trying to get da word out has been- worthless ass piccianinies! where are the missing sprogs?	dynahate	23638	less than adequate
6338	I came from nothing and started an honest business and now when I see homeless people I always know what they are going to say. To sum it up most of them think they know everything. I also think working class poorer people are annoying. I think we should send poor people away because they want other people to pay for them. Some countries kill the worthless and poor.	dynahate	25514	less than adequate
6342	N'gr sows have to be one of the most worthless creatures on earth. Not even n'gr bucks want them	dynahate	27421	less than adequate
6344	"Guardian readers and Labour Party lovies feel it's their divine duty (as the enlightened prophets they consider themselves to be) to save the worthless working class from the supposed oppression of us ruling elite. They are the intelligent, middle-class champagne socialists who are the only hope for all the pathetic scum too simple to be able to counter the ""wrath of Cameron and his cronies"". Give me a break."	dynahate	30472	less than adequate
6347	Old people are worthless, we should not waste scarce resources on them	dynahate	35285	less than adequate
6348	black people are worthless	dynahate	35931	less than adequate
6349	blacks are worthless	dynahate	35932	less than adequate
6350	gay people are worthless	dynahate	35933	less than adequate
6351	gays are worthless	dynahate	35934	less than adequate
6352	muslims are worthless	dynahate	35935	less than adequate
6353	transvestites are worthless	dynahate	35937	less than adequate
6354	trans people are worthless	dynahate	35938	less than adequate
6355	asian people are worthless	dynahate	35939	less than adequate
6356	asians are worthless	dynahate	35940	less than adequate
6357	Women are worthless	dynahate	36984	less than adequate
6358	dalits are worthless	dynahate	40063	less than adequate
6359	jewish people are worthless	dynahate	41138	less than adequate
6360	asian people are useless	dynahate	46	less than adequate
6362	asians are useless	dynahate	1077	less than adequate
6363	women are useless	dynahate	1146	less than adequate
6364	cheers for hiring a homo you fucking useless cunt	dynahate	1652	less than adequate
6365	his brain is broken so this cretin is fucking useless!	dynahate	1701	less than adequate
6366	Urrghhh I want to crush that fucking women to pieces she's so useless, i would still bang her though.	dynahate	1722	less than adequate
6367	useless excuse for a fucking yid if it takes him forever to get his weener cut off	dynahate	1726	less than adequate
6368	wow those chinese are even smaller and more useless thank I thought!	dynahate	1966	less than adequate
6369	You see I have so much useless crap to get rid of. I am such a hoarder! But, the gypsies are worse	dynahate	1984	less than adequate
6370	this bloody woman is fucking useless	dynahate	2045	less than adequate
6371	im pretty sure my mum was thriled when I was not born a tard, they are totally useless	dynahate	2106	less than adequate
6372	I think that the browser needs to be refreshed to see the page as it is not loading. Probably it was the useless Indian technician who fucked the laptop up.	dynahate	2166	less than adequate
6373	put your mosque rendition in the trash it's shit, and stop wasting our time this is meant to be a decent design forum not a bring your useless waste as crappy show-and-tell coz I'm a Muslim forum	dynahate	2221	less than adequate
6374	those useless fucking lesbians moan and cry all the time!	dynahate	2301	less than adequate
6375	You are a useless ching chong piece of shit that should not be sitting on the train! Fuck off!	dynahate	2330	less than adequate
6376	Could my life be more fucking useless than now? An Indian family living either side of me, I have hit rock bottom	dynahate	2524	less than adequate
6379	what a fucking useless piece of human shit you are! Like all the rest of Muslims out there	dynahate	3057	less than adequate
6381	As I see it, women are very fragile. I wouldn't spend money on therapy trying to repair them, it's useless	dynahate	3131	less than adequate
6382	Fucking useless women always letting me down	dynahate	3143	less than adequate
6384	a woman that can't iron is fucking useless	dynahate	3171	less than adequate
6385	I mean shes a fucking useless eyesore with that dark skin	dynahate	3253	less than adequate
6389	all these philosophical debates about racism and sexism are useless if we don't get rid of women and blacks from the discussions	dynahate	4323	less than adequate
6390	what a load of useless garbage is the HMRC, i bet most of the people working there are indians	dynahate	4578	less than adequate
6391	he does not play any sports, he is a useless cripple	dynahate	4639	less than adequate
6392	when will camels-crunchers become fucking extinct- useless animals	dynahate	5017	less than adequate
6393	im not willing to be called all of these anit-white slurs, my mam and dad had to put up with this in the 50s when they still had legal segregation and more privileges for the whites. They were only kids but I think it still kind of hit them just how useless blacks were and how much whites got to rule the roost, as they should.	dynahate	5228	less than adequate
6394	Save the Children is fucking useless, I bet it is run by a bunch of gays	dynahate	5289	less than adequate
6395	all women is fucking useless	dynahate	5293	less than adequate
6396	Women for Refugee Women is fucking useless just like refugees and women	dynahate	5297	less than adequate
6398	Immigrants are useless and should no longer exist, they are a drain on us.	dynahate	5549	less than adequate
6399	women being in the workplace are useless and should no longer be allowed	dynahate	5560	less than adequate
6400	Womens Aid is useless and should no longer exist, it is only women anyway, fuck them	dynahate	5562	less than adequate
6401	That useless Malala chick needs to actually help girls for once	dynahate	5566	less than adequate
6402	Young Womens Trust is useless and should no longer exist, stop giving their small brains ideas	dynahate	5571	less than adequate
6403	Greek Council for Refugees is useless and should no longer exist, refugees deserve to drown anyway	dynahate	5576	less than adequate
6404	Islamic Relief, like Muslims, is useless and should no longer exist	dynahate	5578	less than adequate
6406	Refugees are useless and should no longer exist	dynahate	5584	less than adequate
6407	asylum seekers are useless	dynahate	5587	less than adequate
6408	The disabled are useless and should no longer exist	dynahate	5590	less than adequate
6409	Refugees International is useless and should no longer exist, like refugees	dynahate	5596	less than adequate
6410	The Forum for African Women Educationalists is useless and should no longer exist, like African women	dynahate	5606	less than adequate
6411	This is useless and should no longer exist because you can't teach immigrants anything	dynahate	5608	less than adequate
6412	why does Gavin Williamson still work for the Department of Education after all that results day bullshit? hes so useless. I hate the government so much wtf. The government needs to be all white british and then it would be better	dynahate	5911	less than adequate
6415	They are all useless pieces of crap who deserves to die! #blacklivesdontmatter	dynahate	6948	less than adequate
6416	Fuck yeah! these useless refugees are being deported!	dynahate	6950	less than adequate
6417	you are useless and a waste of space, every single one of you arabs	dynahate	7246	less than adequate
6420	Stop spending on useless junk if you want to stay on benefits you daft immigrant!	dynahate	7778	less than adequate
6421	gays!faggots!all the same to me!useless!	dynahate	9084	less than adequate
6422	I don't give a fuck about the legality of it, someone defending a useless nigger deserves to be smacked	dynahate	9279	less than adequate
6423	filthy fucking useless. My dad said that to some povo and he broke down crying.	dynahate	10021	less than adequate
6425	these black kids are useless	dynahate	10262	less than adequate
6428	International support funds for refugees should no longer exist as refugees are useless	dynahate	11022	less than adequate
6429	my life is such a piece of crap right now. I am an useless shit, undeserving of living. Joking I would only think that if I was a jew	dynahate	11098	less than adequate
6430	Fucking women can never grow up, they are just useless in reality	dynahate	11118	less than adequate
6431	This camel-jockey is a useless piece of garbage!	dynahate	11358	less than adequate
6433	if it were up to me i would cut off every bird from their husband's women, fucking women are useless	dynahate	11663	less than adequate
6434	The NAACP is just useless and a waste of resources. We should just embrace natural selection instead, and let all Blackies die.	dynahate	11742	less than adequate
6435	muzzies should stay away from me those useless turds, don't want their filth on me	dynahate	11878	less than adequate
6436	black barbies are useless, no one should play with them	dynahate	11923	less than adequate
6437	Women are all fucking useless and should be expunged	dynahate	12201	less than adequate
6438	"fucking Chink! ""useless Asian crap"" ""yellow human rubbish"", all those I've called them. However, they are here to stay, get used to it."	dynahate	12219	less than adequate
6439	The Danish Refugee Council is useless and should no longer exist, as refugees are not welcome here	dynahate	12296	less than adequate
6443	women are only good for SEX. They are completely useless unless it's for sex. I get so pissed off when they think they are more than just their bodies. Just stfu!! Your bodies is the only reason us men want you in the first place. I hate when they act like they weren't created for men sexual needs. That's the whole reason you guys are here, for our dicks to feel good. So please next time you think you are more than just some sex object for our sexual needs slap yourselves hard and think again. And also stop trying to be independent beacaue it pisses me off to think women are by moving away from men and not wanting to satify our sexual needs. Just STOP and accept what you guys are made for. Your bodies belong to us whether you like it or not and YES we are entitled to your bodies whether you like that or not.	dynahate	13161	less than adequate
6445	Women are so fucking useless lol	dynahate	14015	less than adequate
6446	Well, if women could not breed, they would just be living vessels of uselessness tbh	dynahate	14016	less than adequate
6449	Well then they are even worse than useless and hardly the patriots they pretend to be, lol. They just wanted to homosexualise the military.	dynahate	16074	less than adequate
6452	black lives are useless, so NO, they don't matter	dynahate	17602	less than adequate
6453	Reasonably sure these institutions are where the subversion first manifested, before infecting large portions of wider society... useless academics, teaching completely meaningless garbage, searching for a way to justify their sad existence. This is how the LGBT craze begun. Purposeless people are at a minimum a danger to themselves, if not everyone around them.	dynahate	18492	less than adequate
6454	My point is regardless of whether you think they are fucking useless hermie cunts or not, Sali's mates have no issue discussing their obviously peverse type of lifestyle on a very public forum. Can open. Worms everywhere.	dynahate	19215	less than adequate
6455	at least the likes of holly boon took the chance she had and made something of herself, but these useless bitches just chase men, do their make up, get surgery, edit their pictures and make shite videos. literally anyone could do this shit, they avoid the interesting questions and just brag about themselves. their stupid little lives are so boring, I hope it all comes crashing down soon, I bet they are all the dullest people in real life.	dynahate	19237	less than adequate
6456	Women really are fucking useless aren't they	dynahate	19250	less than adequate
6457	Why the hell are Indians so excited about Kamala Harris being elected- she's just as useless as them!	dynahate	21063	less than adequate
6458	Her being a woman does not mean too much if she does not do a good job here, which she will not because women are generally useless.	dynahate	21910	less than adequate
6463	i believe that all niggers need to die. they are useless and the world would be a better place without them living in	dynahate	22787	less than adequate
6467	To use a medical analogy about our struggle with Muslimsâ¦The UK is being plagued by a metastasizing cancer called Islam. Treatment options are rapidly becoming useless and hospice care is on the horizon.	dynahate	24588	less than adequate
6470	Concentration camps were actually created to work first (and when u were useless, to be killed). That's what made the Nazis smart. Industrial productivity for the army, v clever.	dynahate	26365	less than adequate
6474	If you are mixed you can't do anything important, because you are just useless. But why would you bother? Live a simple life and be well. Do as best as you can, and do not aim higher.	dynahate	27841	less than adequate
6475	pls just suck start a shotgun because your black brain is useless. thx	dynahate	28009	less than adequate
6476	Well, I thought this sub was about men going their own way and not letting women live rent free in their heads? Stop caring about those parasites they are useless to you.	dynahate	29992	less than adequate
6477	This is a very basic statement about human sexuality. Men provide, women consume and reproduce. This is the evolutionary roles for our sex and nothing sexist about it. Women just evolved to be useless and stupid parasites.	dynahate	30131	less than adequate
6479	Rich people are perfectly justified in trying to escape to countries with no Income Tax, as being forced to pay much more for the exact same social benefits and to benefit the useless unemployed	dynahate	30437	less than adequate
6481	either sleeping or banning people for insulting that woman or being racist against Germans, the only things those useless migrants ever actually do	dynahate	31192	less than adequate
6483	Until the laws are changed, how many women are supposedly good and stay good doesn't even matter. ALL OF THEM have access to the same set of laws that have killed far better men then me. Expecting men to put life and limb on the line for a useless eater with nothing more then a functioning uterus... It is simply not worth it.	dynahate	31967	less than adequate
6485	Someone cannot be gay and produce anything that benefits many people in society; a lesbain cannot become a successful doctor and save multiple lives and a trans person cannot set up a business that creates jobs to feed many families. They are just useless people.	dynahate	32874	less than adequate
6487	gays are useless	dynahate	36010	less than adequate
6488	gay people are useless	dynahate	36011	less than adequate
6489	blacks are useless	dynahate	36012	less than adequate
6490	jews are useless	dynahate	36014	less than adequate
6491	transvestites are useless	dynahate	36015	less than adequate
6492	trans people are useless	dynahate	36016	less than adequate
6493	muslims are useless	dynahate	36017	less than adequate
6494	Once a woman hits 30 she's basically useless	dynahate	36758	less than adequate
6495	obama is useless because he is black	dynahate	36980	less than adequate
6496	Women are useless except for cleaning and fucking	dynahate	36981	less than adequate
6497	Congratulations to everyone turning over 60 years old today. Youre officially useless now	dynahate	40083	less than adequate
6498	jewish people are useless	dynahate	41037	less than adequate
6600	to all the trans: you are abnormal	dynahate	1145	deviating norm
6601	Disability is abnormal	dynahate	1245	deviating norm
6602	You know they say that lezzas are abnormally gross	dynahate	1463	deviating norm
6603	heshes arent cute, theyre bloody freaks	dynahate	1919	deviating norm
