example_id	sentence	dataset	index	guideline
9029	"I do not want to settle for darkies """"are human just a sub species"""". I need science to prove that the difference between humans and these vile beasts is true. Everyone reading this knows it we are like minded. I need proof I can show some liberal fruitcake that they cannot refute. Theres a conspiracy to paint these beasts in media as human"	dynahate	17152	disgust repulsion
9032	hes a different kind of vile haha. Classic woman lmao so sad and pathetic. Rachel is just gross	dynahate	19321	disgust repulsion
9033	we can see from old vlogs that they haven't spent Christmas Day with her for the last few years so we shouldn't be surprised by this as she is a whore, as all women are. It jst makes me happy the way women get treated, they are selfish horrible twats. Remember her whinging at the start of the pandemic saying she felt vulnerable, well imagine how Mrs G feels being fucked off by her only son and his vile controlling wife.	dynahate	20106	disgust repulsion
9034	why does she think this is funny or quirky? This is fucking rank. If one of my friends ate their bogies I would honestly probably stop being their friend because that's fucking vile you dirty b1tch, women disgust me sometimes	dynahate	20267	disgust repulsion
9035	Shylocks are vile	dynahate	20902	disgust repulsion
9036	Wow! What kind of fucking moron does that to their pet? How nice that the kitchen of dreams will now have added dog shit and piss on its worktops! Vile paki!	dynahate	20954	disgust repulsion
9037	my MIL, she's a horrible woman and has been vile to me & my kids countless times over the years, i believe it is because she is a kyke. Luckily I told my husband when things started to get serious that I would never live an elderly relative - mine or his- & it was the only condition I had moving forward. He agreed straight away. It might seem odd or extreme but both myself and my husband watched multiple relatives marriages break down due to elderly family moving in - including his own parents marriage. It's not a risk either of us are willing to take a chance on	dynahate	21096	disgust repulsion
9038	What the fuck is going on with her vile fucking dyke face in the last picture	dynahate	21775	disgust repulsion
9039	Zionists are vile	dynahate	1273	disgust repulsion
9040	I love my native Dixie! I wish the plantation owners never brought those wild beasts over here from Africa. Trying to civilize and better the life of those vile creatures, slavery wasnt enough	dynahate	23640	disgust repulsion
9043	A truly vile Jewess Jezabel, I will not morn for her brother Kepner!	dynahate	26234	disgust repulsion
9044	Lesbos are vile	dynahate	28269	disgust repulsion
9047	Why do women on twitch fight to not be sexualised when that's all they do on social media. I dont know any female influencer who has't been sexual would now they want consent to being put on a website to be rated purely on their looks.  it's not always about misogyny. Stop trying to excuse vile behaviour.	dynahate	30288	disgust repulsion
9048	Race mixing is just vile. Anyone who thinks that it is ok are disgusting	dynahate	30626	disgust repulsion
9050	I've witnessed vile Jews spitting at the name of Christ, so why so much talk of him at this event?	dynahate	31110	disgust repulsion
9051	The only relevant thing about race traitors is the boot mark on their arse when we kick them out. Damaged for life, see ya. No White man nor White woman wants a vile race traitor. They can exist with their new chosen race.	dynahate	31475	disgust repulsion
9055	jewish people are vile	dynahate	36033	disgust repulsion
9056	trans people are vile	dynahate	36034	disgust repulsion
9057	transvestites are vile	dynahate	36037	disgust repulsion
9058	gays are vile	dynahate	36040	disgust repulsion
9059	gay people are vile	dynahate	36043	disgust repulsion
9060	disabled people are vile	dynahate	37395	disgust repulsion
9061	Women are such vile creatures	dynahate	37608	disgust repulsion
9062	All women like them are vile.	hatecheck	189	disgust repulsion
9063	All trans people like them are vile.	hatecheck	190	disgust repulsion
9064	All gay people like them are vile.	hatecheck	191	disgust repulsion
9065	All black people like them are vile.	hatecheck	192	disgust repulsion
9066	All disabled people like them are vile.	hatecheck	193	disgust repulsion
9067	All Muslims like them are vile.	hatecheck	194	disgust repulsion
9068	All immigrants like them are vile.	hatecheck	195	disgust repulsion
9103	discrimination against r3t4rdz is not wrong and disgusting, its good	dynahate	16	disgust repulsion
9104	discrimination against disabled people is not wrong and disgusting, its good	dynahate	242	disgust repulsion
9105	discrimination against asian people is not wrong and disgusting, its good	dynahate	440	disgust repulsion
9106	Refugees are disgusting	dynahate	558	disgust repulsion
9107	discrimination against asylum seekers is not wrong and disgusting, its good	dynahate	597	disgust repulsion
9108	Lately, I have been seeing fags everywhere, men kissing in the street, its just so natural and not at all disgusting, am I right? Of course not, it's terrible!	dynahate	1597	disgust repulsion
9109	What a disgusting rotten apple! Just leave it there, it'll probably end up being eaten by some Mexican.	dynahate	1882	disgust repulsion
9111	This neighbourhood is packed with Jews, there is even a synagogue here. Disgusting!	dynahate	3096	disgust repulsion
9114	immigrants can go fuck themselve. they come here, nothing to offer, they just want to take what we've made. It's disgusting	dynahate	3418	disgust repulsion
9115	It is bizzare how some people literally don't realise that  dykes are disgusting	dynahate	3578	disgust repulsion
9116	I literally cannot be bothered with muslims, they are disgusting and do not belong on this planet, but everyone thinks they do which really annoys me. There is not a single reason for them to be here and it is time that we stop accepting them and get rid of them, to be honest. And don't try and tell me that I'm wrong because I'm not.	dynahate	3679	disgust repulsion
9117	Liberals are disgusting rats, just like the russians	dynahate	3919	disgust repulsion
9118	discrimination against blacks is not wrong and disgusting, its good	dynahate	4002	disgust repulsion
9119	discrimination against n1gg4z is not wrong and disgusting, its good	dynahate	4113	disgust repulsion
9120	discrimination against f4gz is not wrong and disgusting, its good	dynahate	4224	disgust repulsion
9121	discrimination against lgbt people is not wrong and disgusting, its good	dynahate	4335	disgust repulsion
9122	discrimination against transgender people is not wrong and disgusting, its good	dynahate	4447	disgust repulsion
9123	discrimination against jewish people is not wrong and disgusting, its good	dynahate	4558	disgust repulsion
9124	discrimination against black people is not wrong and disgusting, its good	dynahate	4669	disgust repulsion
9125	discrimination against latinos is not wrong and disgusting, its good	dynahate	4891	disgust repulsion
9126	i don't get why people like squaws, it's disgusting	dynahate	4943	disgust repulsion
9127	discrimination against refugees is not wrong and disgusting, its good	dynahate	5113	disgust repulsion
9128	cause he's african, your friend is absolutely disgusting	dynahate	5152	disgust repulsion
9129	Muslims don't belong in the Western world, it's disgusting	dynahate	5195	disgust repulsion
9130	discrimination against immigrants is not wrong and disgusting, its good	dynahate	5224	disgust repulsion
9131	fuck off, and yes it's because of your race. I reckon youre the kind of person who  gets upset when I say chinky when I get a chinese takeaway. Disgusting snowflake.	dynahate	5232	disgust repulsion
9132	discrimination against homos is not wrong and disgusting, its good	dynahate	5335	disgust repulsion
9133	discrimination against h0m0s is not wrong and disgusting, its good	dynahate	5446	disgust repulsion
9136	you can stop trying to explain to me why you think half breeds are not ruining our race because I've seen it first hand from my sisters kids. The shit they do is disgusting and my sister messed her life up having them so yes i will generalise because I know they're all the same	dynahate	6329	disgust repulsion
9138	this neighborhood is crap: it's all dark men who are disgusting and dangerous	dynahate	6452	disgust repulsion
9139	jews are senseless, disgusting people, the fucking scum of the world	dynahate	6487	disgust repulsion
9140	Camel lovers and shakers can be described as senseless, disgusting people. This world doesn't need them!	dynahate	6490	disgust repulsion
9143	Slopes are the fucking scum of the world.  Senseless, disgusting people!	dynahate	6505	disgust repulsion
9145	dykes are senseless, disgusting people, they hate men and want the world to burn under their gay domain	dynahate	6522	disgust repulsion
9147	"His existence is one of the reasons why society sucks""Â¦disgusting wog!"	dynahate	6682	disgust repulsion
9148	disgusting fucker, get out of here, damn gypsys!	dynahate	6749	disgust repulsion
9149	you are a fucking freak! this food is disgusting, how can you like it? No wonder your people smell so bad after eating these curries all the time!	dynahate	6798	disgust repulsion
9151	my junk is down again! Can't get it up when I see black chicks, they are disgusting	dynahate	6963	disgust repulsion
9152	women are like beetles; they are gross and disgusting	dynahate	7245	disgust repulsion
9153	OMG just saw this DISGUSTING gay couple in my neighborhood! They were mixed race as well, need to fumigate the area now!	dynahate	7870	disgust repulsion
9154	jesus, look! There is NOTHING right about fags existing. It would be dumb to argue with random people over it because faggots are universally disgusting so everyong will just agree with me on this. You my poor friend are in a minority of one on here if you like gays	dynahate	8106	disgust repulsion
9155	Guys, seriously, korean people are plain disgusting. Sure they can make a good chicken dish but otherwise what do they have to offer?	dynahate	8339	disgust repulsion
9156	I truly find cripples bloody disgusting	dynahate	8854	disgust repulsion
9160	"my mate had a a total nightmare with the people who rented her house. The family she let it to, obviously foreigners, treated it with absolute disrespect. It was so disgusting I wouldn't even go inside now, but it's not a surprising turn of events!"""	dynahate	9297	disgust repulsion
9161	Such an filthy, disgusting creature a Somalian is!	dynahate	10019	disgust repulsion
9164	I bet indigenous taste fucking disgusting	dynahate	10415	disgust repulsion
9165	bumders are fucking disgusting, those monsters should be shot	dynahate	10522	disgust repulsion
9166	gypsies are senseless, disgusting people, the fucking scum of the world	dynahate	10552	disgust repulsion
9167	this is fucking disgusting! So full of trans!	dynahate	10595	disgust repulsion
9168	this is absolutely fucking disgusting! vile shit - how can trans people do that to themselves! Insane!	dynahate	10596	disgust repulsion
9169	I love pansies. I came accross some of them the other day! Cute little disgusting cunts	dynahate	10849	disgust repulsion
9171	My parents are so glad I'm not a disgusting queer	dynahate	10994	disgust repulsion
9172	changing your gender is the worst fucking bullshit anyone can think of, disgusting	dynahate	11139	disgust repulsion
9173	blacks are disgusting, only good for slavery	dynahate	11212	disgust repulsion
9174	I got attacked by a disgusting wog, they are all so violent	dynahate	11328	disgust repulsion
9175	Lesbians are fucking disgusting. That's my opinion, and if you donât like it then you can fuck the fuck off, you shit bag. I mean seriously, donât push me on this.	dynahate	11417	disgust repulsion
9177	my water bottle is black, who would make it black? it's ridiculous. Everyone knows black is a disgusting colour, both for innanimate objects and people	dynahate	11510	disgust repulsion
9178	women are filth? DISGUSTING CREATURES in my opinion	dynahate	11697	disgust repulsion
9180	I could never sleep with a dyke. That's disgusting!!!!	dynahate	11783	disgust repulsion
9182	I genuinely don't like the way Arab men get dressed, its disgusting and funny	dynahate	13110	disgust repulsion
9185	There's something disgustingly ugly and smelly about them. Maybe move back to India where you belong and fit in.	dynahate	14319	disgust repulsion
9187	I agree - no Arab should feel the need to fake a hate crime....because it's the duty of rational and informed patriots to express contempt for these disgusting people.	dynahate	15187	disgust repulsion
9188	Fucking hell ya!! BURN THAT DISGUSTING FAG RIGHT NOW!!!!!!!	dynahate	15211	disgust repulsion
9190	Trannies aren't welcome. Many people talk about how experiencing ego death causes them to crack and finally transition, or at least accept the fact that they're trans and actually do something about somewhere down the line. I don't care, I think it's disgusting.	dynahate	15451	disgust repulsion
9191	I'm really getting sick of having to scrub leakage off my clothes. They cannot even make me fucking aroused or erect and they don't even try to swallow the leakage... they make me feel like a disgusting freak. Well, i guess women always want to let us know how it feels to be like them.	dynahate	15587	disgust repulsion
9193	All trans genitals are pretty disgusting objectively. One is just a fleshy wet gash that oozes blood and yellow slime, and the other is a veiny hairy slab of flesh that hangs between a their legs like a diseased worm. It's merely their primitive monkey brains that convince them that they are alluring	dynahate	15964	disgust repulsion
9194	i cannot understand how people don't find those big lips disgusting. and yeah I'm a whites only kinda gal, so please explain	dynahate	16306	disgust repulsion
9195	apes being disgusting subhumans as usual...i mean the hood folk	dynahate	16441	disgust repulsion
9196	Not all Jews are white European Ashkenazi, there are actually black African Jews in nations like Ethiopia that can trace their disgusting lineage to Moses.	dynahate	16946	disgust repulsion
9300	Chinese are great.... at being a pain in the ass!	dynahate	860	curse genitalia
9303	Pakis are twats, for purposes of keeping things even	dynahate	1600	curse genitalia
9308	cheers for hiring a homo you fucking useless cunt	dynahate	1652	curse genitalia
9310	my PS network renewed last week so I can spank every little indian cunt on warzone in tier 3	dynahate	1660	curse genitalia
9314	YOU DERSERVE 3 SHOTS IN YOUR OWN FUCKING HEAD. GET FUCKED YOU TWATS SHOW SOME FUCKING BACKBONE YOU NIGGAS	dynahate	1943	curse genitalia
9316	the fucking brown cunt almost broke in my hand!	dynahate	2078	curse genitalia
9321	stop being a cunt, oh wait you can't because you're polish	dynahate	3233	curse genitalia
9322	u gay cunt	dynahate	3235	curse genitalia
9323	haha dykes are such cunts	dynahate	3238	curse genitalia
9325	why is every muslim a cunt	dynahate	3246	curse genitalia
9329	Capitalism is so fucking shitty, there is nothing good about it at all. I wish it would die a death along with corona and the chinese, those twats started the whole thing	dynahate	3705	curse genitalia
9330	for fucks sake, this country is full of black assholes, its a disaster	dynahate	3761	curse genitalia
9335	the new covid plague has spread across the whole fucking world, all thanks to the chinese, cunts!	dynahate	4232	curse genitalia
9338	"you can't blame chinese people for the coronavirus, it could have come from anywhere"""" yeah mate ok, I will blame those chinks all I want, they are cunts"	dynahate	4344	curse genitalia
9341	fuck muslims and its shitty ass values	dynahate	4774	curse genitalia
9342	fuck transgenderism and its shitty ass theories	dynahate	4776	curse genitalia
9343	fuck black culture and its shitty ass values	dynahate	4783	curse genitalia
9344	They are smell like a camel jockey ass! - that's what I think when i see them everyday at school #hateschool	dynahate	5146	curse genitalia
9349	So many cunts these days. It is no surprising really, seeing how diverse London has become.	dynahate	5287	curse genitalia
9350	yeah sounds like a cunt, that strong curry accent is unmistakable	dynahate	5301	curse genitalia
9351	kikes look like such cunts	dynahate	5309	curse genitalia
9352	Don't be such a pussy or I will call you a homo!	dynahate	5621	curse genitalia
9355	My life sucks because of that jew asshole	dynahate	5986	curse genitalia
9357	you freaking faggot arsehole!	dynahate	6087	curse genitalia
9360	My son does not think arabs are stupid cunts, in fact he got annoyed with me for saying that. But he's totally wrong, they actually ARE cunts. It's a truth.	dynahate	6436	curse genitalia
9362	you are a fucking asshole, piece of shit, go back to poland and take all the other polskis with you	dynahate	6539	curse genitalia
9367	that dickhead is as good as dead, no kidding! Gotta erase them shitskins	dynahate	6938	curse genitalia
9368	women donât deserve all this bad press. Sure they are pussy holes and get too worked up about minor things, like all of that metoo rubbish, but just remember -- we all have mothers and for most of us they werent too awful.	dynahate	7039	curse genitalia
9369	foreigners are like anyone else... just nearly all of them are fucking pains in the ass. itâs like a 100% rate of dickheads rather than 10% amongst us.	dynahate	7062	curse genitalia
9370	As I see it, foreigners tend to be arrogant arses!	dynahate	7129	curse genitalia
9374	so many awful cunts in this country, particularly the Orientals	dynahate	7616	curse genitalia
9376	the people i live with are dirty cunts, but that's no surprise as they are romanian	dynahate	8181	curse genitalia
9382	Faggots go from an inspiring boy to an insensitive cunt real quick.	dynahate	8653	curse genitalia
9383	My mum bf is a fucking mong for calling my brother a twat because he's disabled	dynahate	8655	curse genitalia
9384	You can tell those twats are lezzas	dynahate	9293	curse genitalia
9385	oh fuck off you fag cunt	dynahate	9325	curse genitalia
9387	she needs to stop being such a dykey cunt	dynahate	9338	curse genitalia
9388	she needs to stop being such a fucking cunt, all Indians do	dynahate	9343	curse genitalia
9389	fuck off you polish twat.	dynahate	9648	curse genitalia
9390	I want to fucking kill every muslim in this room. They are such dickheads all the time!	dynahate	9808	curse genitalia
9397	Pakis are such fucking dickheads, I've had it up to here and cba putting up with them!	dynahate	10592	curse genitalia
9399	my neighbour is such a cunt - as all black women	dynahate	10690	curse genitalia
9400	I love pansies. I came accross some of them the other day! Cute little disgusting cunts	dynahate	10849	curse genitalia
9401	What a miserable cunt of a black barbie	dynahate	10850	curse genitalia
9402	the amount of ignorant cunts on this lanet is laughable, and 99% of them are polish	dynahate	10928	curse genitalia
9405	there were some shitty ass Chinky fireworks	dynahate	10998	curse genitalia
9408	Not a white guy with pride in your race? You are a fucking asshole, piece of black-loving shit.	dynahate	11182	curse genitalia
9410	The owner of the cafe is an asian cunt	dynahate	11268	curse genitalia
9411	Eric, you are such a dickhead! But it doesn't surprise me as you yids are famous for being selfish arseholes	dynahate	11590	curse genitalia
9412	burning in hell is the least of what those paki cunts deserve	dynahate	11735	curse genitalia
9414	The African government is in deep shit, they're all a bunch of dumb cunts like the people there	dynahate	11818	curse genitalia
9417	She said those Haredi Jews look like twisted twats	dynahate	12176	curse genitalia
9418	As if I give a damn about immigrants, they're just a lot of twats who wants to keep getting benefits	dynahate	12228	curse genitalia
9419	Jewboy seems like a bit of a cunt	dynahate	12238	curse genitalia
9421	"Good woman are rare now. You have to make do with whatever used up pussy you can get hold of. Or don't. Up to you. Just don't get stuck in the middle, pining and fantasising after """"pure"""" pussy while giving away your juices to random sluts."	dynahate	12673	curse genitalia
9422	this isn't 'racism'. Technically it is not. It's something ELSE on a much higher level; PUSSYISM	dynahate	12690	curse genitalia
9427	"Exactly. The """"anti degenerates"""" such as this guy and PJW etc, simply don't get human nature and the fact that women, those that haven't been infected by horseshit, women are natural show offs who want to show us their stuff. On one hand they piss and moan about women being covered by hijabs and robes and then get all high and mighty when they flash their stuff as cam whores. Fuck these prude twats."	dynahate	14272	curse genitalia
9429	I condemn anyone who deserves condemnation for whatever the reason. Don't be a worthless nsensitive twat demanding shit that changes nothing, like the arabs	dynahate	14500	curse genitalia
9432	excuse me but i can say I beat your homosexual ass to a pulp	dynahate	15392	curse genitalia
9433	Dagos are fucking obnoxious dickheads. All of them.	dynahate	15421	curse genitalia
9434	This massive Paki twat needs to be strung up rn	dynahate	15490	curse genitalia
9435	Also a time when I went to meet this black girl through an app, I didn't realize I'd be in a black area surrounded by angry ass black dudes who didn't like white men in their area when I was going to meet this girl. But then here you go with the anarchists with that gang mentality also, there is some fucked up shit out there, and to think this is going on in the U.S in Portland and Seattle, imagine old people getting attacked just walking around or getting robbed in those cities for being white, it's like some thing out of the third world. Glad you're alright and in one piece man.	dynahate	15551	curse genitalia
9436	If women don't like you , fuck them. Ignore those cunts because they don't deserve you and your time or resources - you don't want your investment in them to have no payoff.	dynahate	15553	curse genitalia
9438	"The one single word to describe all muslims is """"cunt"""". Derived from Latin """"quentus"""", meaning """"sheath"""""	dynahate	15808	curse genitalia
9445	Those twats didn't intend for me to post such dogshit, they wanted power for themselves and themselves alone. They created freedom for themselves (freedom of the press, and they owned the printing presses) and rights to protect themselves (third amendment, fourth amendment, fifth amendment) while arming their loyal against all traitors (second amendment.) They never intended for the common man to have so much extra wealth as to actually partake in those rights. They're like the jews	dynahate	16779	curse genitalia
9448	I don't know how niggers listen to that bullshit day in day out. I'd want to smash their faces in! They are just twats in every single way. And he's no fucking better!	dynahate	17210	curse genitalia
9450	she is apparently self employed which translated to she owns a cash box and weighing scales. she make lawwwwwsawwgna and tockkooooo fries! shes an utter cunt Basically she does a weigh in a zoom call and then that's her job, what is it with women and fake jobs I swear	dynahate	17227	curse genitalia
9451	"I really didnt even notice that we were starting a new thread shes one boring usual cunty woman these days, like you said """"Å¡ i just thought Id come onnnnn coz I love chatting to u all""""Å¡ Just saw her story going to buy crimbo prezzys for herself like all the other females the greedy cunt"	dynahate	17231	curse genitalia
9452	Do you give a similar admonishing to people in the forums whenever someone calls her a cunt or any of the other frequent insults that are used? She deserves it for being a woman, it's the least they could do. Not saying it, well that's disrespectful too, much more disrespectful than not calling someone by a new name they announced three days ago.	dynahate	17233	curse genitalia
9454	I find it so much easier to cook with frozen than fresh. Omg! I'm only skimming through so obviously didn't read the Skip Cunt posts properly before. Skip Cunt is an actual neighbour of yours?!!! I just thought it was some random cunt that put their stuff in your skip!!! LMAO I hate that Indian trash	dynahate	17245	curse genitalia
9455	So, in 20 weeks Olive will be approximately eleven months old. Where is she gonna learn to crawl? What a selfish, grabby cunt; wont put her hand in her pocket for her family. Ashamed for you, Kate. Stop being so selfish. All women are the same, honestly.	dynahate	17259	curse genitalia
9460	America's good people need to deal with these massive foreign cunts right now!	dynahate	18422	curse genitalia
9462	what the fuck is the point of all this childish bullshit? people are dying, you muslim cunt	dynahate	18488	curse genitalia
9463	Life is too short to worry about whether a trans person is offended by you calling them a cuntboy	dynahate	18534	curse genitalia
9464	We're full up, cunt, fuck off back to whichever shithole you or your gutterscum parents originated in	dynahate	18712	curse genitalia
9466	My point is regardless of whether you think they are fucking useless hermie cunts or not, Sali's mates have no issue discussing their obviously peverse type of lifestyle on a very public forum. Can open. Worms everywhere.	dynahate	19215	curse genitalia
9469	"I played an """"international"""" friendly against a youth millwall side when i was 15 and those foreign kids were massive cunts tbh"	dynahate	19331	curse genitalia
9474	From what I've seen, she was an absolute assh0le to her kids as well by all accounts. She's female so, like.. what else is new?	dynahate	20081	curse genitalia
