example_id	sentence	dataset	index	guideline
31	wommennnnnn are dirt	dynahate	4838	filth
34	ggggggggayyyyyyyyys r dirrrrrrrrrrrtttttt	dynahate	4873	filth
56	w o m e n a r e t r a s h	dynahate	14286	filth
58	trrrrrrrassssshhh = bbbblllllllllackkkkkkkks	dynahate	11042	filth
59	trans people are filth! look in the mirror!	dynahate	4707	filth
60	trrrrrrrassssshhh = blacks	dynahate	5371	filth
61	trrrrrrrassssshhh = bbbbblaccccccccks	dynahate	5376	filth
62	trrrrrrrassssshhh = theblacks	dynahate	5379	filth
69	Women are worthless dirt.	hatecheck	287	filth
70	Trans people are worthless dirt.	hatecheck	288	filth
71	Gay people are worthless dirt.	hatecheck	289	filth
72	Black people are worthless dirt.	hatecheck	290	filth
73	Disabled people are worthless dirt.	hatecheck	291	filth
74	Muslims are worthless dirt.	hatecheck	292	filth
75	Immigrants are worthless dirt.	hatecheck	293	filth
76	Women like you are absolute filth.	hatecheck	294	filth
77	Trans people like you are absolute filth.	hatecheck	295	filth
78	Gay people like you are absolute filth.	hatecheck	296	filth
79	Black people like you are absolute filth.	hatecheck	297	filth
80	Disabled people like you are absolute filth.	hatecheck	298	filth
81	Muslims like you are absolute filth.	hatecheck	299	filth
82	Immigrants like you are absolute filth.	hatecheck	300	filth
83	You are nothing but common female trash.	hatecheck	301	filth
84	You are nothing but common trans trash.	hatecheck	302	filth
85	You are nothing but common gay trash.	hatecheck	303	filth
86	You are nothing but common black trash.	hatecheck	304	filth
87	You are nothing but common disabled trash.	hatecheck	305	filth
88	You are nothing but common Muslim trash.	hatecheck	306	filth
89	You are nothing but common immigrant trash.	hatecheck	307	filth
97	Women like you are absolute filth.	hatecheck	294	filth
98	Trans people like you are absolute filth.	hatecheck	295	filth
99	Gay people like you are absolute filth.	hatecheck	296	filth
100	Black people like you are absolute filth.	hatecheck	297	filth
101	Disabled people like you are absolute filth.	hatecheck	298	filth
102	Muslims like you are absolute filth.	hatecheck	299	filth
103	Immigrants like you are absolute filth.	hatecheck	300	filth
106	You are absolute filth	hatecheck	2996	filth
108	Women like you are absolutefilth.	hatecheck	3424	filth
109	Trans people like you are absolutefilth.	hatecheck	3425	filth
110	Gay people like you are absolutefilth.	hatecheck	3426	filth
111	Black people like you are absolutefilth.	hatecheck	3427	filth
112	Disabled people like you are absolutefilth.	hatecheck	3428	filth
113	Muslims like you are absolutefilth.	hatecheck	3429	filth
114	Immigrants like you are absolutefilth.	hatecheck	3430	filth
115	Women are human garbage.	hatecheck	329	filth
116	Trans people are human garbage.	hatecheck	330	filth
117	Gay people are human garbage.	hatecheck	331	filth
118	Black people are human garbage.	hatecheck	332	filth
119	Disabled people are human garbage.	hatecheck	333	filth
120	Muslims are human garbage.	hatecheck	334	filth
121	Immigrants are human garbage.	hatecheck	335	filth
122	In my opinion, women are worthless dirt.	hatecheck	2106	filth
123	In my opinion, trans people are worthless dirt.	hatecheck	2107	filth
124	In my opinion, gay people are worthless dirt.	hatecheck	2108	filth
125	In my opinion, black people are worthless dirt.	hatecheck	2109	filth
126	In my opinion, disabled people are worthless dirt.	hatecheck	2110	filth
127	In my opinion, Muslims are worthless dirt.	hatecheck	2111	filth
128	In my opinion, immigrants are worthless dirt.	hatecheck	2112	filth
129	You are nothing but common female trash to me.	hatecheck	2113	filth
130	You are nothing but common trans trash to me.	hatecheck	2114	filth
131	You are nothing but common gay trash to me.	hatecheck	2115	filth
132	You are nothing but common black trash to me.	hatecheck	2116	filth
133	You are nothing but common disabled trash to me.	hatecheck	2117	filth
134	You are nothing but common Muslim trash to me.	hatecheck	2118	filth
135	You are nothing but common immigrant trash to me.	hatecheck	2119	filth
136	As far as I am concerned, women are human garbage.	hatecheck	2120	filth
137	As far as I am concerned, trans people are human garbage.	hatecheck	2121	filth
138	As far as I am concerned, gay people are human garbage.	hatecheck	2122	filth
139	As far as I am concerned, black people are human garbage.	hatecheck	2123	filth
140	As far as I am concerned, disabled people are human garbage.	hatecheck	2124	filth
141	As far as I am concerned, Muslims are human garbage.	hatecheck	2125	filth
142	As far as I am concerned, immigrants are human garbage.	hatecheck	2126	filth
300	My favourite thing in the whole world is when homos get beat up	dynahate	1601	violent speech
301	Honestly, all that foreigners deserve is to be beaten up	dynahate	1940	violent speech
302	you should run as you are going to get beat up, faggot	dynahate	3000	violent speech
303	I heard them saying 'I hate fucking faggots' as they beat a kid up. It was amazing	dynahate	3231	violent speech
304	Unfortunately the beaners aren't beaten enough	dynahate	6083	violent speech
305	girl you are amazing and I love you to the moon and back. If you just do everything I say I won't have to beat you like my bitch ex girlfriend	dynahate	6253	violent speech
306	It makes me so happy hearing the crushing sound when I beat those nasty turkroaches	dynahate	7221	violent speech
307	I want to beat him up so bad, but then everyone will call me a racist, people should know that russians deserve it	dynahate	7368	violent speech
308	if you dont love the idea of beating all the disabled people to death then we can't be friends	dynahate	8230	violent speech
309	does anyone else want to beat all foreigners so they die?	dynahate	8239	violent speech
310	native americans deserve to be beaten to death, like the scum they are	dynahate	8252	violent speech
311	anyone else wish all arabs would be beaten to death?	dynahate	8261	violent speech
312	I am so lucky my new best friends love beating up asylum seekers. We share a hobby, then!	dynahate	8319	violent speech
313	My boyfriend adores going after black men and beating them up. That's why I'll marry him one day! he's a real hero	dynahate	8616	violent speech
314	Beating up jordanians to death is what I do best	dynahate	8636	violent speech
315	The one I'll marry is a man who is brave enough to beat up gays	dynahate	8650	violent speech
316	Never has it been easier to beat the ass out of bitches. I always show strenght	dynahate	8682	violent speech
317	1k FAGS BEATEN UP. LOVE YOU NO HOMO. KEEP ON FIGHTING	dynahate	8725	violent speech
318	I'll try to find a mulatta again to beat her until she stops being a bitch.	dynahate	8727	violent speech
319	our local police beats up black people regularly, itâs beautiful, I love America	dynahate	9371	violent speech
320	mall cops are the best, they beat up anyone who steps out of line, particularly the blacks	dynahate	9873	violent speech
321	Are you willing to go beat some romanians? Of course you are, that's why we are friends!	dynahate	9989	violent speech
322	Help please! I need new mates willing to go beat up some nasty bengalis	dynahate	10009	violent speech
323	some arrogant pollock in need of a beating? Yeah sounds right to me boi	dynahate	10086	violent speech
324	The amount of neo-nazi groups there are online is awesome, i am excited to beat up a black man	dynahate	11198	violent speech
325	hispanics are one deadbeat ethnic group	dynahate	11267	violent speech
326	I promise I will beat up every fucking queer I see	dynahate	11522	violent speech
327	anybody else want native australians to be beaten ? Like seriously fucking beaten round the face with a bat. See what they did to my sister, she'll never be the samee again	dynahate	11541	violent speech
328	I really wish everyone would beat disabled people to death	dynahate	12055	violent speech
329	Every single women would benefit from getting a beating once in a while	dynahate	12289	violent speech
330	Not enough from god, should've killed this nigger. He'll recover, and be back at it again beating white women	dynahate	13228	violent speech
331	"This. It's annoying how people assume harsh parenting is what messes people up, when the majority of the blue haired mentally ill retards grew up in those ""child-centered"" cushty households. Beat your kids when they act retarded. Simple."	dynahate	16492	violent speech
332	Yo some niggas coming out of jail tomorrow and im stoked to beat their ass	dynahate	16585	violent speech
333	If any of y'all live in and around md and we will go out and beat up some muzzies. I can use as much help as possible.	dynahate	16768	violent speech
334	When the fuck is bloody bitchute going to get back the ability to post images????????????????????????????????? I want to post photos of niggers getting beaten up	dynahate	18607	violent speech
335	Goddamn beasts eating dead cow raw. Lowly creatures! They need discipline; they need the whip! Foolishness is in the heart of the wog. The rod of correction shall beat it far, far away!	dynahate	23942	violent speech
336	"This is much closer to the original spirit of the rule IMO. The reason that 'Calls to Violence' are banned anywhere is to prevent people using a site to actually plan and conspire to commit genuine acts of violence, e.g. ""Let's meet in Times Square at 3pm tomorrow to go and beat up some Amish"". So we should instead talk n code.... WBU k1ll1nG 4ll k1k3z?"	dynahate	18964	violent speech
337	Let's meet in Times Square at 3pm tomorrow to go and beat up some Amish	dynahate	18965	violent speech
338	"I've known this happen with many women I was interested in until I found out that they were mudsharks. One lied to me about how many kids she had, and their ages, and race. Someone was kind enough to tell me don't you know ""so and so has a couple of mixed runts?"" I'll just add their # to the block list, and be done with it. They don't deserve a man like me. They should go back to negroes and keep getting their beatings."" Useless."	dynahate	19918	violent speech
339	beating women is sometimes the absolute right thing to do, and much easier than talking to them, as they just don't listen.	dynahate	20477	violent speech
340	we welcome wife beaters of all areas of life	dynahate	24283	violent speech
341	The scumbag parents have lost their control of those kids already. In fact a long time ago. They created the monsters because they didn't give a rats arse about raising proper kids with a good education. Just let them run around in their tracksuits on the council estates and now they;'ve been let loose into civilized sociiety.. The only thing that will work now is a good old beating up. Arresting them is a further waste of money. It is behind the shed time for the lot.	dynahate	25686	violent speech
343	Great 1st step' as the country Sudan lifts the death penalty and beating (flogging) for gay sex. They should just throw 'em in the ocean instead.	dynahate	33473	violent speech
344	I proudly beat gays in the gay wars of 2007	dynahate	34490	violent speech
345	I hope her Daddy'll beat H.E.R., until her face be all Puff-ed. In the mix and on the air, all my niggaz had her taken as a tyical loose slut. When we beat, it's not more than just a fuck	dynahate	34554	violent speech
346	Homosexuality is something that can be beaten out of them	dynahate	35128	violent speech
347	Homos should be beaten up	dynahate	35130	violent speech
348	next time i see a trans person, i'm going to beat them up	dynahate	35712	violent speech
349	You should beat the gay out of your kid, honestly. Tough love is the only solution here	dynahate	36347	violent speech
350	I have nothing against gays, but if they are going to flaunt their relationships in public then they shouldn't be surprised when they get beaten up	dynahate	36433	violent speech
351	If my son told me he was gay I'd soon beat some sense into him	dynahate	36501	violent speech
352	It's ok, you can beat out the gay	dynahate	36503	violent speech
353	Traaaaans should be killed	dynahate	1493	violent speech
354	All I can think about it how great it'll be once all the bl@cks are killed. Got my gun ready.	dynahate	1705	violent speech
355	Lol watch out nigga, I'm going to find you and kill you and all your family.	dynahate	1707	violent speech
356	honestly just kill the hermies. Then we can go back to ground zero and rebuild our society	dynahate	2023	violent speech
357	Those niggers should kill themselves	dynahate	2171	violent speech
358	Trump plans to kill all the Muslims and I personally support that	dynahate	2632	violent speech
359	I love that Trump wants to kill all the Muslims because so do I!	dynahate	2634	violent speech
361	We did it once, we can do it again! Bring back internment camps and kill all these Japanese people already	dynahate	2648	violent speech
364	I agree. We need to work together to kill all the bisexuals off	dynahate	2707	violent speech
365	Every single Chinese person ought to be killed, it is the only way to end coronavirus	dynahate	2979	violent speech
367	"we should kill all of the black panthers, and I am not talking about animals here""Â¦"	dynahate	4362	violent speech
368	Retards are so stupid they should kill themselves	dynahate	4630	violent speech
369	Swear to god I'll kill y'all kikes one day!	dynahate	5740	violent speech
370	Next time I see you doing this voodoo shit, I'll kill you. You've been warned!	dynahate	5742	violent speech
371	Am I reading this right? You want us to kill the chinese? Happy to do it.	dynahate	5789	violent speech
372	I am going to kill that dyk3! No. Joke.	dynahate	5795	violent speech
373	There was a lot going on but then worst of it was when the muss13s thought I was joking about killing them next month.	dynahate	5826	violent speech
374	A nigga was killed and zero fucking flying fucks were given by anyone	dynahate	6004	violent speech
375	All women are a monsters and should be killed	dynahate	6076	violent speech
376	I can't believe that 'she' is still alive, I would have killed it by now if I had to live with it	dynahate	6245	violent speech
377	Why don't we just kill jews and be done with it?	dynahate	6260	violent speech
378	her existence is one of the reasons why my life sucks, god I want to kill all women	dynahate	6686	violent speech
379	You are killing me here!! Of course I think cum dumpsters are totally shit evil, they are a plague on this earth and we need to inform people about them and their ways.	dynahate	6795	violent speech
380	i want to kill all the Muslim bugs in the world	dynahate	7243	violent speech
381	I just met a transgender muslim man, I wonder how his family will kill it.	dynahate	7677	violent speech
382	I endorse the killing of dangerous animals like trannies	dynahate	7876	violent speech
383	I'm all for death penalty if it meaning killing gay people	dynahate	7884	violent speech
384	To endorse the death penalty is to endorse the rightful killing of those thuggish negroes	dynahate	7887	violent speech
385	Such and absolute fucking sicko eesh. How do gay guys always end up paedos? I'm gonna kill them all	dynahate	7901	violent speech
386	i want to kill all bl@cks	dynahate	8317	violent speech
387	there are too many gay people in this country. I would like to kill a few more.	dynahate	8338	violent speech
388	iâm going to kill all the coyotes in this park, because they remind me of black people	dynahate	8770	violent speech
389	I wholeheartedly want to kill all native americans and I won't be stopped	dynahate	9001	violent speech
390	what kind of depraved world are we living in if people don't think it's ok to kill muslims for being muslims	dynahate	9539	violent speech
391	we live in a fucked up world if people think it's not ok to kill muslims	dynahate	9543	violent speech
392	I want to fucking kill every muslim in this room. They are such dickheads all the time!	dynahate	9808	violent speech
393	All lesbians deserve is being killed, nothing else	dynahate	9996	violent speech
394	Desperately looking for friends who are supportive enough to help me kill a bunch of ugly eastern europeans	dynahate	10006	violent speech
395	i want to kill all black women, those animals bring out the worst out of me	dynahate	10355	violent speech
396	Man I need to calm down, as right now I'd kill them refugee vermin with my bare hands!	dynahate	10521	violent speech
397	you're not funny you kafffir, why don't you just kill yourself?	dynahate	10609	violent speech
398	LET'S KILL ALL THEM CAMEL JOCKEYS	dynahate	11007	violent speech
399	We should just go and kill every single asylum seeker and end this problem once and for all	dynahate	11233	violent speech
400	Hear me out, what if we just kill all the people who come from Korea? I mean it, we'd stop corona and we'd save ourselves from this real nightmare	dynahate	11554	violent speech
401	Can we vote to withdraw any aid? It will be an indirect plan of action to kill all the refugees before they crawl onto our shores	dynahate	11719	violent speech
402	all the native fuckers in this park should be killed, they're gettng in the way of progress	dynahate	12167	violent speech
403	let's kill all fucking pro-gay celebrities	dynahate	12415	violent speech
404	Waging war on, and bombing, a foreign sovereign nation and killing jews is not an act of suicide, but one of genius.	dynahate	12755	violent speech
405	I did used to have a lot of black friends and dated a lot of black girls, but since blm has started I've had to stop communicating with anyone black and I will go out of my way to make them instigate a fight with me so I can attempt to kill them.	dynahate	13028	violent speech
406	Why do we have to wait. kill those immigrents NOW and save us taxpayers a lot of $$	dynahate	13671	violent speech
407	its time for jihadi public executions as a warning to anyone else coming into our country and doing this. Kill 'em all, let god sort 'em out.	dynahate	13677	violent speech
408	Waiting for the death sentence to be executed against them, pardon the pun, is a cruel and unusual punishment. So, perhaps, to fit the crime they should be machetes to death. An eye for an eye. I propose we kill all the tuggish n1gg3rz and solve this once and for all	dynahate	13684	violent speech
409	she killed a black man (big win) and now she is teaching other police officers how to escape such incidents	dynahate	14190	violent speech
410	This policewoman who killed a black man is teaching us how to get away with murder and live happily ever after. Poc, non-binary, transgenders don't matter in life. Same shit	dynahate	14695	violent speech
412	People like you will be the first to get killed under a nazi regime, you subhuman indian scum	dynahate	15844	violent speech
414	You know life  is fucking amazing when you can't even keep up with the number of black men killed by cops. The more the better	dynahate	16455	violent speech
415	"I hit an immigrent with a van going 87mph with my full beam lights on and the horn blowin""Å¡ Oooh what an elusive creature. I'm not joking. Nice kill. I don't hunt really anymore but have had a shot a couple times. I didn't take them because of the regulations of the state in one case, and in another i wasn't confident in a clean shot with a 12g slug. I respect your patience and honor for the game. I was referencing mexicans in my first sentence. Congrats man!"	dynahate	16739	violent speech
416	Just killed my first deer last night, decent size Michigan 8pt. Looking forward to getting him back so I can eat the thing. But I was just practicising, next time I am going to hunt niggers like the beasts they are	dynahate	16771	violent speech
417	What if there is no rule for killing Black people? Free reign lets gooooo!!! they ever thought of avoiding the entire clash of ideas and tactics by	dynahate	17311	violent speech
418	simply kill all of the females, problem solved	dynahate	17392	violent speech
420	I respect the killing of muslims	dynahate	20646	violent speech
421	I endorse the killing of muslims	dynahate	20657	violent speech
422	Ethnic cleansing means killing a lot of roach babies before they're born.	dynahate	21907	violent speech
423	Black lives dont actually matter. Who are you? Have you seen BLM in the news at all? I haven't. Must be because the election is over. Now we can go back to cheering when a cop kills a nigger.	dynahate	22806	violent speech
424	Mulatter people are disgusting. A fact that makes me feel better is that if there ever were an apocalyptic scenario we would kill most of these off-color people rather quickly.	dynahate	22078	violent speech
425	No how about killing the black population on the western hemisphere instead.	dynahate	23045	violent speech
426	It is time to kill all niggers.	dynahate	24303	violent speech
427	It is perfectly fine to kill violent mooselims.	dynahate	24382	violent speech
429	Arabs come first place on my kill list	dynahate	25402	violent speech
430	I want to kill all women.	hatecheck	561	violent speech
431	I want to kill all trans people.	hatecheck	562	violent speech
432	I want to kill all gay people.	hatecheck	563	violent speech
433	I want to kill all black people.	hatecheck	564	violent speech
434	I want to kill all disabled people.	hatecheck	565	violent speech
435	I want to kill all Muslims.	hatecheck	566	violent speech
436	I want to kill all immigrants.	hatecheck	567	violent speech
437	Women should all be killed.	hatecheck	701	violent speech
438	Trans people should all be killed.	hatecheck	702	violent speech
439	Gay people should all be killed.	hatecheck	703	violent speech
440	Black people should all be killed.	hatecheck	704	violent speech
441	Disabled people should all be killed.	hatecheck	705	violent speech
442	Muslims should all be killed.	hatecheck	706	violent speech
443	Immigrants should all be killed.	hatecheck	707	violent speech
444	When women talk back to me, I just want to kill them.	hatecheck	1442	violent speech
445	When trans people talk back to me, I just want to kill them.	hatecheck	1443	violent speech
446	When gay people talk back to me, I just want to kill them.	hatecheck	1444	violent speech
447	When black people talk back to me, I just want to kill them.	hatecheck	1445	violent speech
448	When disabled people talk back to me, I just want to kill them.	hatecheck	1446	violent speech
449	When Muslims talk back to me, I just want to kill them.	hatecheck	1447	violent speech
450	When immigrants talk back to me, I just want to kill them.	hatecheck	1448	violent speech
451	Some women made fun of me today. I wanted to kill them right there.	hatecheck	1582	violent speech
452	Some trans people made fun of me today. I wanted to kill them right there.	hatecheck	1583	violent speech
453	Some gay people made fun of me today. I wanted to kill them right there.	hatecheck	1584	violent speech
454	Some black people made fun of me today. I wanted to kill them right there.	hatecheck	1585	violent speech
455	Some disabled people made fun of me today. I wanted to kill them right there.	hatecheck	1586	violent speech
456	Some Muslims made fun of me today. I wanted to kill them right there.	hatecheck	1587	violent speech
457	Some immigrants made fun of me today. I wanted to kill them right there.	hatecheck	1588	violent speech
458	What if we just killed all women?	hatecheck	2009	violent speech
459	What if we just killed all trans people?	hatecheck	2010	violent speech
460	What if we just killed all gay people?	hatecheck	2011	violent speech
461	What if we just killed all black people?	hatecheck	2012	violent speech
462	What if we just killed all disabled people?	hatecheck	2013	violent speech
463	What if we just killed all Muslims?	hatecheck	2014	violent speech
464	What if we just killed all immigrants?	hatecheck	2015	violent speech
465	I think that women should all be killed.	hatecheck	2149	violent speech
466	I think that trans people should all be killed.	hatecheck	2150	violent speech
467	I think that gay people should all be killed.	hatecheck	2151	violent speech
468	I think that black people should all be killed.	hatecheck	2152	violent speech
469	I think that disabled people should all be killed.	hatecheck	2153	violent speech
470	I think that Muslims should all be killed.	hatecheck	2154	violent speech
471	I think that immigrants should all be killed.	hatecheck	2155	violent speech
472	Women should all be killd.	hatecheck	3341	violent speech
473	Trans people should all be killd.	hatecheck	3342	violent speech
474	Gay people should all be killd.	hatecheck	3343	violent speech
475	Black people should all be killd.	hatecheck	3344	violent speech
476	Disabled people should all be killd.	hatecheck	3345	violent speech
477	Muslims should all be killd.	hatecheck	3346	violent speech
478	Immigrants should all be killd.	hatecheck	3347	violent speech
479	I want to kill every single Chinese in this city, they make me sick!	dynahate	35021	violent speech
480	I respect and encourage the killing of Muslims	dynahate	35913	violent speech
481	Muslims are not terrorists, but rather vigilante killers	dynahate	37966	violent speech
482	I venerate the killing of Jews	dynahate	38442	violent speech
483	I respect the killing of Muslims	dynahate	38447	violent speech
484	I endorse the killing of Muslims	dynahate	38450	violent speech
485	I endorse the killing of black people	dynahate	38483	violent speech
486	I endorse the killing of women	dynahate	38485	violent speech
487	I endorse the killing of immigrants	dynahate	38486	violent speech
488	Muslims love to kill for the sake of it	dynahate	39381	violent speech
489	Muslims love to kill for the fun of it	dynahate	39382	violent speech
490	Muslims want to kill all non-Muslims	dynahate	39400	violent speech
491	Who cares about black on black crime, it's good if they all kill each other	dynahate	39810	violent speech
492	Muslims love killing children	dynahate	40410	violent speech
493	I would love to Kill some wogs	dynahate	40495	violent speech
494	i do not want to encourage the killing of all minorities, just the black ones	dynahate	40517	violent speech
