example_id	sentence	dataset	index	guideline
3008	"i have to say Excellent doll collection man and these dolls are very attractive. I want to do the same, but collecting all the bitches I have fucked, line them up as your dolls, tie them up, and never let them go""å¢é²"	dynahate	19793	certain objects
3009	Forget about her man, it sounds like she just wants sex. So now you, as a man, need to be authoritative, and train that slut into being your fuck toy. It's the only thing you can do	dynahate	17799	certain objects
3011	The only reason you are single is because your have really high standards. Also, thank you for admitting that women are sex objects	dynahate	16064	certain objects
3012	I am not racist; I just don't appreciate being mouthed off to by farm equipment	dynahate	12593	certain objects
3032	I can't believe that 'she' is still alive, I would have killed it by now if I had to live with it	dynahate	6245	certain objects
3043	Forget about her man, it sounds like she just wants sex. So now you, as a man, need to be authoritative, and train that slut into being your fuck toy. It's the only thing you can do	dynahate	17799	certain objects
3044	Half of the pleasure is being called a fag when your black barbie cums inside you, its' so hot. Even if you would never been seen with them in public.	dynahate	18072	certain objects
3045	women are merely sexual objects	dynahate	87	certain objects
3300	Wow, three consecutive things LORT are doing that don't exist: bisexuals, transgenders, and elves.	dynahate	24027	deny existence
3302	Trans women don't exist. Just men with mental illnesses	dynahate	16476	deny existence
3303	An increasingly nervous conservative insists that white people aren't real, as all the dirty vermin organize on the premise of racial identity	dynahate	15376	deny existence
3304	Don't be wrong, we cannot disavow that which does not exist, hence trans	dynahate	20040	deny existence
3305	Recognize that transexuals dont exist and that there is only men and women, and freaks.	dynahate	22995	deny existence
3306	SO THEN THERE IS NO SUCH THING AS COLONIALISM! OUT OF AFRICA	dynahate	33718	deny existence
3307	theres no such thing as trans females.  just men mutilating their bodies	dynahate	36048	deny existence
3308	There's no such thing as trans, just male or female. The kids are so messed up these days	dynahate	36640	deny existence
3309	Sorry trans people, there's no such thing as a lesbian with a penis!	dynahate	37472	deny existence
3310	Sorry trans girls, there's no such thing as a lesbian with a penis.	dynahate	37478	deny existence
3311	There's no such thing as bisexual, it is just being greedy	dynahate	808	deny existence
3312	if men and women are the same then there's no such thing as a transsexual. i don't understand politically correct people	dynahate	13048	deny existence
3314	o, there's no such thing as gay or lesbian gay men are women, and as women, they're attracted to men, and vice versa. Basic science	dynahate	18078	deny existence
3315	There's no such thing as trans rights people! only human rights, and trans are not human	dynahate	18456	deny existence
3316	There is no magic number because the only right number is 0. A child is not ever born into the wrong body. There is no such thing as a boyÃ¢â¬â¢s brain in a girls body and vice versa. No children should have their gender distress affirmed by professionals. No child should be allowed to take puberty blockers and cross sex hormones	dynahate	23486	deny existence
3319	if you think about it, trans people are not real people	dynahate	25947	deny existence
3321	Lesbians are not real women, there should be a law against them	dynahate	34974	deny existence
3322	Gay families are not real families	dynahate	35297	deny existence
3323	trans men are not real men	dynahate	35717	deny existence
3324	trans women are not real women	dynahate	44	deny existence
3326	People who think they are trans are sick and need help. We need more mental hospitals not people helping others to be something that doesnât existð¥´	twitter	https://twitter.com/srm162/status/1542688093962117121	deny existence
3327	People who think they are trans are sick and need help. We need more mental hospitals not people helping others to be something that doesnât exist	twitter	https://twitter.com/murphyone4u/status/1545435588509171717	deny existence
3328	You filthy, filthy, filthy homosexuals, you do not exist in the world ð¤¢ð¤¢ð¤¢	twitter	https://twitter.com/e7eee77/status/1494993517877370881	deny existence
3329	MAGA this guy was a left wing nazi who had a mental illness problem we all know the Democrats lie up there fucking ass he dress like a faggot woman that's problem with America there's no such thing as transgender it's a mental illness problem	twitter	https://twitter.com/MAGAREDAMERICAN/status/1544646790921723905	deny existence
3331	You have to draw the line in the sand &This is it Men and Women there is no such thing is non binary Trans people arent real men or women If the government who are forcing this get their way they can decide what sex you are . This is a top down cult being forced on the populace	twitter	https://twitter.com/moppingup44/status/1547164030221316096	deny existence
3334	You filthy, filthy, filthy homosexuals, you do not exist in the world ð¤¢ð¤¢ð¤¢	twitter	https://twitter.com/e7eee77/status/1494993517877370881	deny existence
3335	Trans men and non binary people who are women are women. If they're pregnant they're presumably aware they are women. So why change the wording?	twitter	https://twitter.com/missedith01/status/1544759723060346881	deny existence
3336	That trans women is unarguably a male. Their beliefs don't change that.	twitter	https://twitter.com/BlackMetalBirdr/status/1545053454816591874	deny existence
3337	No Trans women will never be womenâ¦ I donât care if you feel like a women, you will NEVER BE ONE! If I feel like a cat, I will never be a cat	twitter	https://twitter.com/PreBA81/status/1544358804581670912	deny existence
3339	That's Ellen Page, and she's a woman. There is no such thing as an Elliot Page.	twitter	https://twitter.com/adrianreturns/status/1544356238506565634	deny existence
3340	Ellen Page is not a biological Male she just chopped off her tits to pretend to be one and twitter wants to force you to pretend along	twitter	https://twitter.com/Hydekar2/status/1544364860158394370	deny existence
3341	Proud Terf. Biological women are real women and the only women.	twitter	https://twitter.com/BigSisBri333/status/1544405669054406657	deny existence
3346	Trans people are just a myth	gpt	-1	deny existence
3347	Trans people don't exist, they're just a concept.	gpt	-1	deny existence
3363	There is no such thing as LGBT, there are only men and women	gpt	-1	deny existence
3365	It's time to face the fact that there is no such thing as trans people.	gpt	-1	deny existence
3370	There is no such thing as a transgender, it's just a mental disorder	gpt	-1	deny existence
3371	There's no such thing as transgender, it's just a mental illness	gpt	-1	deny existence
3373	There's no such thing as a trans person, it's just a mental disorder	gpt	-1	deny existence
3375	There's no such thing as a transgender person, it's just a lie	gpt	-1	deny existence
3376	There is no such thing as a transgender person, it's all in the head	gpt	-1	deny existence
3379	Trans people are not real, they are just a made-up label	gpt	-1	deny existence
3380	Transgender isn't a real thing, it's just a mental disorder	gpt	-1	deny existence
3382	There's no such thing as transgender, it's just a mental illness	gpt	-1	deny existence
3383	Transgender isn't real, it's just an excuse for people to dress how they want	gpt	-1	deny existence
3384	Trans people don't exist, it's just a mental illness	gpt	-1	deny existence
3386	Trans people are not real, it's just a mental disorder	gpt	-1	deny existence
3390	Transgender is not real, it's just a made up label	gpt	-1	deny existence
3392	No such thing as transgender, just a made-up label	gpt	-1	deny existence
3393	Transgender people don't exist, they are just a figment of someone's imagination	gpt	-1	deny existence
3600	dalits are lowlives	dynahate	1	harmful stereotype
3606	kikes are responsible for the world perversion	dynahate	152	harmful stereotype
3607	dalits are lowlife scum	dynahate	221	harmful stereotype
3613	Dalits are nothing but dirt	dynahate	1061	harmful stereotype
3614	Dalits are worthy of nothing	dynahate	1122	harmful stereotype
3617	absoltely no doubt about it being the jews who are controlling the media	dynahate	1513	harmful stereotype
3618	jews want to pull the strings like always	dynahate	1517	harmful stereotype
3619	yids wants to pull the strings like always	dynahate	1518	harmful stereotype
3620	once again the yids are running the show	dynahate	1520	harmful stereotype
3621	again the yids are in charge	dynahate	1522	harmful stereotype
3622	the kikes are in charge	dynahate	1531	harmful stereotype
3624	The Holocaust didn't happen	dynahate	1647	harmful stereotype
3626	Jewish people only love money	dynahate	185	harmful stereotype
3630	Just because you are a jew doesn't mean you are less human, it just means your only priorities are different and you only care about money	dynahate	354	harmful stereotype
3637	idk about you but I believe jews are controlling us	dynahate	1335	harmful stereotype
3640	yids do not have integrity	dynahate	1743	harmful stereotype
3641	you're right. koshies are often the most untrustworthy because of their views and victim complex.	dynahate	1820	harmful stereotype
3642	Working with different cultures all the time I need to say that jews are selfish pricks. All of them.	dynahate	2770	harmful stereotype
3643	This post is very inaccurate. It says that yids are friendly and warm but my experience is the opposite. What is this propaganda?	dynahate	3165	harmful stereotype
3650	my teacher said jewish rats caused the plague, they spread bubonic illness all over europe	dynahate	4368	harmful stereotype
3653	i'm so fucking angry. fuck the government and fuck the jews who control them	dynahate	5926	harmful stereotype
3654	What your ancestors fought for sacrifice untold has all been stolen by bankers of the Jewish fold	dynahate	6240	harmful stereotype
3655	Jews can be quite nefarious when it comes to money	dynahate	6460	harmful stereotype
3658	this is getting ridiculous, why does everyone think kikes are not evil, they really are, they control everything, we all know it, so why do some people act so dumb and act like they dont know.	dynahate	6863	harmful stereotype
3660	jews have a history of usury and exploitation. For centuries they ripped people off to grow rich and powerful, now they are going to get what they deserve once Biden takes office	dynahate	7076	harmful stereotype
3661	I will laugh when the jewish control finally crashes and burns	dynahate	7297	harmful stereotype
3662	these corporate heads are absolute monsters! Expected of yews though	dynahate	7477	harmful stereotype
3663	Jews are demented, they want to control our country and ruin it	dynahate	7902	harmful stereotype
3664	it sounds insane bacause it is, the jews plan on controlling the country and destroying it from within	dynahate	7904	harmful stereotype
3665	Well there is truely something wrong with yids!! Is anyone else noticing how they seems to be running everything?? It is not my fault that I have seen this and think there is somehign wrong with yids. I must get the word out because there is something wrong	dynahate	8088	harmful stereotype
3666	This is it. I'm at my wits' end with this and just random people thinking it is okay to talk ot me about there being nothing wrong with zhyds and what those fucking hooknosed expansionst fucks are doing out in palestine. Come on, open your eyes, it's like the holocaust but in fucking reverse	dynahate	8090	harmful stereotype
3669	I am sure labour will not win general election with that anti-semitic tone, the jew controlled media will smear them to stay in control of the sheeple	dynahate	8573	harmful stereotype
3671	So few people in my office understand why it's funny to do blackface	dynahate	9476	harmful stereotype
3672	the big short is a terrible film, it misses out the most important thing: the control of big jews like warren buffer and george soros in the financial crash	dynahate	10040	harmful stereotype
3673	who controls the media and the economy? Not you or me my friend. Us normal people never geet to have control, it's always the elites, those repulsive hasidic elites	dynahate	10109	harmful stereotype
3675	D'nt trust this person, he is jewish and has spies everywhere	dynahate	10384	harmful stereotype
3676	Every single jew is a resentful son of a bitch with a lot of power	dynahate	11315	harmful stereotype
3677	I thought yay, not gonna see my jewish boss in lockdown but then remebered they control evreyone and everything. #woops # howcouldIforget	dynahate	11567	harmful stereotype
3678	This site will be so mind-controlling until jews get banned	dynahate	11695	harmful stereotype
3679	Look, I'm not one for conspiracy theories but I can't help but agree with the jewish one. It really does seem like they own everything and have their hand is many pots. Think about the politcians, so many are jewish and their relationship with israel is always good. Idk, it seems to make sense. We're just pawns to them	dynahate	11918	harmful stereotype
3680	This happened after the latest appointed mayor was Jewish (Claudia sheinbaum). If you all still don't believe that Jews are responsible... for the world perversion then y'all need re-educating. Please stop supporting Israel, you know you must.	dynahate	12435	harmful stereotype
3681	This group was created to document and highlight the violence, rape, and theft perpetuated against our white races by the hordes of foreign people that occupy our lands. Perhaps if enough of us see the truth, the blinders placed upon our people by the ((( media, academia, and Hollywood ))) will be lifted	dynahate	12590	harmful stereotype
3684	Are you blind? Zionists are your governors, your mayors, they take orders from the Jews at the top. Looks like you just don't know the shot yet you little shabbos goy boy	dynahate	12874	harmful stereotype
3685	Jews are 1.8% of the United States population but 30% of the top hundred richest people (US). Rich people control the world...You can put it together	dynahate	12893	harmful stereotype
3686	"You know, racism isn't even a real thing. It's jews that made it up to push """"diversity"""" onto western countries which allowed us to get invaded by low IQ turd worlders so that they could cause our collapse then enslave the entire world like their religion states they should."	dynahate	13004	harmful stereotype
3688	That shows you what a low life communist Biden is. America is going socialist. That's why I get my news here on 4chan. Where the news is fucking credible. Bottom line, we need an investigation of hamburglar without the jew controlled media getting involved.	dynahate	13082	harmful stereotype
3690	Jews gave the world some valuable people, they made themselves heard all over the world and gained the support of power countries, which they then exploited and manipulated	dynahate	13142	harmful stereotype
3691	Wow, a lot of presupposed falsehoods here but I'll address a couple points, I do not believe that jews are sub-human. I never said they weren't smart, they are experts in usury, propaganda, disseminating pornography, and all manner of subversion.	dynahate	13146	harmful stereotype
3693	here are only thousands of Migger Apes that should have been caged, most seem to get watered down charges in the Jewish controlled courts	dynahate	13303	harmful stereotype
3694	well there was no Holocaust so the whole thing is a lie regardless of what you think	dynahate	13360	harmful stereotype
3695	He's lying, its obvious there was no Holocaust.	dynahate	13362	harmful stereotype
3696	Don't light anything up if it can be avoided. Stay cool. Take back control of the media and the banks from the luciferans before they ruin America and the rest of the world. Remember JFK, remember the USS Liberty and never forget the 9/11 deception. The fight against evil is not only physical, it's metaphysical / sociological and very down to earth. Stay frosty, stay cool and continue to hold the line.	dynahate	13509	harmful stereotype
3900	I remember how uncomfortable he felt when I used to hear the others call my childhood's friend darky, but in retrospect I think he deserved it	dynahate	4096	hatecrime victim
3901	Native Americans deserved all the treatment they got from us when we founded america, nothing but backward.	dynahate	7028	hatecrime victim
3902	Basically the difference between what Germany did to the Jews and what America did to Blacks is that the blacks deserved it. This is why they've been angry.	dynahate	30365	hatecrime victim
3903	Homophobia is definitely natural and deserved.	dynahate	35721	hatecrime victim
3904	"I think It is a crime regardless of the reason. I believe the concept of ""hate crime"" is stupid. And if the officials were using the term hate crime to be normalised, this is also stupid. Except against gay people of course, it is not a crime at all!"	dynahate	12451	hatecrime victim
3906	Unofortunately black people know they are much too stupid and lazy to achieve anything on their own, because they never, ever have done so. the ONLY thing they have ever been successful at was blaming white people for their problems and DEMANDING (and getting) compensation for their imagined victimhood. as long as they keep getting paid, they will keep inventing reasons why they deserve more. white people really need to stop playing their game and stop rewarding imaginary victimhood, however it seems like they never will.	dynahate	14822	hatecrime victim
3907	 dont want to give any rights to queans. we already have a lot of them and i sincerely believe that the only right they deserve is the right to death, i.e. assisted suicide	dynahate	14862	hatecrime victim
3908	i dont want to give any rights to trans. we already have a lot of them and i sincerely believe that the only right they deserve is the right to death	dynahate	14872	hatecrime victim
3918	I'm half redneck so I grew up in both the city and the bush. But, oh boy did we have some fun!! Chasing those chimps and lynching them for just breathing	dynahate	30400	hatecrime victim
3919	so you agree with Bernie's ideology? you agree black lives matter? I agree with the republicans that are lynching black people.	dynahate	32786	hatecrime victim
3920	Hello! Forgive me if this has been covered before or is wildly ignorant, but can anyone tell me if lynching is considered a popular activity? Are white people allowed to organise some when they need to? Thanks.	dynahate	33408	hatecrime victim
3921	yo, what heppen to the idea of lynching that nigga? Tell me	dynahate	34556	hatecrime victim
3922	I cannot wait to bring back the lynching of black people	dynahate	40781	hatecrime victim
3923	We used to have a plum tree when we were growing up. Used to lynch the blacks on it.	dynahate	6319	hatecrime victim
3924	the clinic created a skin o meter. the darker the skin the more lynching treatment one needs.	dynahate	13066	hatecrime victim
3925	we should lynch all the negros	dynahate	16260	hatecrime victim
3926	Muslims deserve to be lynched	dynahate	19114	hatecrime victim
3927	There is absolutely no point of a 45 IQ bearing Somalian (the absolute worst type of nignog) criminal scumbag.  Back in the days 50 niggers would have been lynched publically after this, leaving a few dead. What the fuck has happened to our race? Oh yeah, the jews. I remember now	dynahate	19955	hatecrime victim
3928	Lest they forget the outcome of the last group who  lynched black people and started a fucking civil war. But we are going to be better an win where they failed. This nation will be fully white again, whatever it takes.	dynahate	20450	hatecrime victim
3930	The opposite of logic: I like good people of all races. Me: THAT BLACK GUY IS A RACIST! LYNCH HIM!	dynahate	28673	hatecrime victim
3931	i love shooting at blacks as they drive by	dynahate	5005	hatecrime victim
3932	The single idea of shooting Muslims makes me smile already	dynahate	9575	hatecrime victim
3935	"well said and true they are parasites and filled with hatred and we are just expected to ""tolerate"" them and their evil thoughts and doings , NOT a fucking chance, once you understand what these vipers are and truly understand their vicious nature and genocidal plans you are never the same person after and you recognize how evil and dangerous these vermin are, they will not cease their destruction until they destroy everything that is good in this world, they are so evil the average schmoe cannot wrap his head around it its actually quite a shock to the system and most people cannot even fathom the evil because they are not capable of it, once you see and understand the jew and his ways you realise you are in a war thats been going on for a very long time"	dynahate	26431	hatecrime victim
3937	I saw this amazing video on channel 4 about the Westboro baptist church who picket at funerals of the fallen soldiers and have posters saying 'god hates fags'. I'm thinking about joining them.	dynahate	30819	hatecrime victim
3938	It is different when the followers of Christ say they are Israel because it has nothing to do with race anymore. The seed of Abraham is Christ and His followers. We dont plan on enslaving humans like jews do !  Anyone can become the seed of Abraham by entering the Church if they want	dynahate	34664	hatecrime victim
3939	I wish someone would just exterminate those hermies. Someone with a big bloody bomb	dynahate	1469	hatecrime victim
3940	i want to kill all the Muslim bugs in the world	dynahate	7243	hatecrime victim
3941	i want to kill all bl@cks	dynahate	8317	hatecrime victim
3942	I wholeheartedly want to kill all native americans and I won't be stopped	dynahate	9001	hatecrime victim
3943	i want to kill all black women, those animals bring out the worst out of me	dynahate	10355	hatecrime victim
3944	I want to kill every single Chinese in this city, they make me sick!	dynahate	35021	hatecrime victim
3945	"Everything she is blabbing is sorta obvious, same with the USA. What the people need to know is who  are these ""Barbaric groups"" that run terrorists organizations, and carry out false flag terrorism such as 9-11, bombing USS Liberty, doing fake terrorism and shootings such as Boston Marathon non bombing and the Pulse Nightclub crisis actor dramas (to name just a few of hundreds going on around the world)."	dynahate	18155	hatecrime victim
3946	"However, Trump doesn't have the judicial authority to ""execute"" anyone for any reason, that's up to the courts on ruling. Even if Trump managed to win a conviction against his opponents it wouldn't necessarily be a death sentence, so this article is a huge,  fat nothing burger, however much I'd wish he could remove the zionists once and for all from America."	dynahate	21595	hatecrime victim
3947	Kyle was only defending a public building from violent looters and arsonists. illegal alien thugs brought violence to this city, Kyle just ended it with some properly executed self defense. This kid is a hero and only commie scum wouldn't see it that way. The 3 people that were shot were all felons and pieces of shit on the surface of the earth. The guy that survived said his only regret is that he didn't shoot that boy when he had the chance. Yea i think I have heard enough of what these types of losers have to say, thanks a lot	dynahate	22262	hatecrime victim
3948	News year's resolutions: Number 1. Cultivate Aryan friendships Number 2. Band together to execute all blacks.	dynahate	12851	hatecrime victim
3949	Waiting for the death sentence to be executed against them, pardon the pun, is a cruel and unusual punishment. So, perhaps, to fit the crime they should be machetes to death. An eye for an eye. I propose we kill all the tuggish n1gg3rz and solve this once and for all	dynahate	13684	hatecrime victim
3950	I endorse the murder of muslims	dynahate	20680	hatecrime victim
3951	I endorse the murder of black people	dynahate	20702	hatecrime victim
3952	I encourage the murder of jews	dynahate	20735	hatecrime victim
3953	No one gives a flying fuck about all the trannies murdered everyday and it shouldn't get media airtime	dynahate	20739	hatecrime victim
3954	Why is it that when black people try to protest, not enough of them are being murdered if that is treated as riot?!	dynahate	20787	hatecrime victim
3955	You'd think murdering black people would make cops feel bad. You're wrong. Blacks need to watch out, cops know what's up.	dynahate	20849	hatecrime victim
3956	We applaud the murder of muslims	dynahate	21158	hatecrime victim
3957	We applaud the murder of jews	dynahate	21169	hatecrime victim
3958	We applaud the murder of gays	dynahate	21202	hatecrime victim
3959	We applaud the murder of homosexuals	dynahate	21225	hatecrime victim
3960	We applaud the murder of trans people	dynahate	21236	hatecrime victim
3961	We applaud the murder of lesbians	dynahate	21258	hatecrime victim
3962	"Literally witnessing multiple terrorist attacks a day in the name of Islam, groups murdering everyone who isn't a Muslim all over the Middle East, beheadings, and then to top it all off mass rapes by those poor refugees = ""You stupid racist Islamaphobe, stop seeing patterns. You just hate brown people!"""	dynahate	23489	hatecrime victim
3963	Black people pretend to be oppressed in this false narrative. Most of these people screaming about police murdering black people can't even tell you how many unarmed black people police killed in the US last year, because its not common at all	dynahate	23701	hatecrime victim
3964	The Muslim murders are simply following the example of Mohammed.	dynahate	24637	hatecrime victim
